{
  "schema": "uniform.rust-screen/v1",
  "scope": "integer screening for absence of pure equilibria in the one-shot continuation-payoff game; not an equilibrium nonexistence claim",
  "deterministic_rng": "counter-based SplitMix64 keyed by (seed,sample_id,payoff_index)",
  "samples": 1000000,
  "seed": 7,
  "payoff_range_inclusive": [
    -4,
    4
  ],
  "elapsed_seconds": 0.0227403,
  "samples_per_second": 43974793.6482808,
  "matching_games": 148994,
  "retained_games": 3,
  "candidates": [
    {
      "sample_id": 164952,
      "seed": 7,
      "pure_deviation_margin": 4,
      "continuation": [
        0,
        0,
        0,
        0
      ],
      "payoffs": [
        [
          4,
          2,
          3,
          -2
        ],
        [
          -3,
          -4,
          3,
          1
        ],
        [
          2,
          4,
          0,
          -2
        ],
        [
          2,
          1,
          -4,
          4
        ],
        [
          -3,
          1,
          0,
          4
        ],
        [
          -3,
          -2,
          -3,
          1
        ],
        [
          0,
          1,
          -4,
          4
        ],
        [
          2,
          -2,
          0,
          1
        ],
        [
          -4,
          -1,
          -4,
          3
        ],
        [
          2,
          2,
          -4,
          2
        ],
        [
          -2,
          2,
          -3,
          2
        ],
        [
          3,
          2,
          0,
          -2
        ],
        [
          -2,
          -1,
          -4,
          2
        ],
        [
          -3,
          -4,
          4,
          2
        ],
        [
          2,
          1,
          -4,
          -2
        ]
      ]
    },
    {
      "sample_id": 405715,
      "seed": 7,
      "pure_deviation_margin": 4,
      "continuation": [
        0,
        0,
        0,
        0
      ],
      "payoffs": [
        [
          -3,
          -4,
          4,
          2
        ],
        [
          -4,
          1,
          4,
          -4
        ],
        [
          3,
          1,
          0,
          3
        ],
        [
          -4,
          0,
          4,
          2
        ],
        [
          -1,
          4,
          2,
          -2
        ],
        [
          0,
          4,
          -4,
          4
        ],
        [
          4,
          -4,
          4,
          1
        ],
        [
          4,
          -1,
          -2,
          3
        ],
        [
          -1,
          0,
          3,
          -2
        ],
        [
          -2,
          3,
          0,
          0
        ],
        [
          1,
          3,
          1,
          -1
        ],
        [
          -3,
          -1,
          2,
          4
        ],
        [
          4,
          0,
          -1,
          4
        ],
        [
          -4,
          4,
          4,
          -3
        ],
        [
          3,
          -4,
          3,
          2
        ]
      ]
    },
    {
      "sample_id": 430755,
      "seed": 7,
      "pure_deviation_margin": 4,
      "continuation": [
        0,
        0,
        0,
        0
      ],
      "payoffs": [
        [
          -2,
          -3,
          -2,
          -4
        ],
        [
          4,
          -4,
          -3,
          4
        ],
        [
          0,
          0,
          1,
          0
        ],
        [
          4,
          -4,
          4,
          1
        ],
        [
          -3,
          -2,
          3,
          -4
        ],
        [
          3,
          2,
          -3,
          -3
        ],
        [
          -1,
          -4,
          1,
          2
        ],
        [
          -1,
          3,
          4,
          -4
        ],
        [
          -4,
          -2,
          2,
          2
        ],
        [
          -2,
          -3,
          -1,
          0
        ],
        [
          3,
          2,
          -4,
          2
        ],
        [
          4,
          4,
          2,
          -4
        ],
        [
          -3,
          4,
          -2,
          0
        ],
        [
          -2,
          -4,
          3,
          3
        ],
        [
          4,
          -1,
          3,
          -2
        ]
      ]
    }
  ]
}
